{
  "$schema": "http://json-schema.org/draft-07/schema#",
  "$id": "consolidated.schema.json",
  "title": "Consolidated Translation Data",
  "description": "Merged translation and verification data for the review app",
  "type": "object",
  "required": ["version", "generatedAt", "summary", "files"],
  "examples": [
    {
      "version": "1.0",
      "generatedAt": "2026-01-30T12:00:00Z",
      "summary": {
        "filesProcessed": 1,
        "examplesTranslated": 1,
        "compilationPassed": 1,
        "compilationFailed": 0
      },
      "files": [
        {
          "path": "src/pages/docs/example.mdx",
          "examples": [
            {
              "id": "Kx9mQ3",
              "lineNumber": 45,
              "original": { "language": "javascript", "code": "await channel.publish('greeting', 'hello');" },
              "translation": { "language": "swift", "code": "channel.publish(\"greeting\", data: \"hello\")" },
              "harness": {
                "functionSignature": "func example(channel: ARTRealtimeChannel)",
                "stubTypes": null,
                "fullContext": "import Ably\n\nfunc example(channel: ARTRealtimeChannel) {\n    // ...\n}"
              },
              "translationNotes": [
                { "type": "decision", "message": "Used callback pattern" }
              ],
              "verification": {
                "compilation": { "status": "pass" },
                "faithfulness": { "rating": "faithful", "notes": null }
              }
            }
          ]
        }
      ]
    }
  ],
  "properties": {
    "version": {
      "type": "string",
      "const": "1.0",
      "description": "Schema version"
    },
    "generatedAt": {
      "type": "string",
      "description": "ISO 8601 timestamp when this file was generated"
    },
    "summary": {
      "type": "object",
      "required": ["filesProcessed", "examplesTranslated", "compilationPassed", "compilationFailed"],
      "properties": {
        "filesProcessed": {
          "type": "integer",
          "minimum": 0,
          "description": "Number of MDX files processed"
        },
        "examplesTranslated": {
          "type": "integer",
          "minimum": 0,
          "description": "Total number of examples translated"
        },
        "compilationPassed": {
          "type": "integer",
          "minimum": 0,
          "description": "Number of examples that compiled successfully"
        },
        "compilationFailed": {
          "type": "integer",
          "minimum": 0,
          "description": "Number of examples that failed to compile"
        }
      }
    },
    "files": {
      "type": "array",
      "description": "Translation data grouped by file",
      "items": {
        "type": "object",
        "required": ["path", "examples"],
        "properties": {
          "path": {
            "type": "string",
            "description": "Path to the MDX file"
          },
          "examples": {
            "type": "array",
            "items": {
              "type": "object",
              "required": ["id", "lineNumber", "original", "translation", "harness", "translationNotes", "verification"],
              "properties": {
                "id": {
                  "type": "string"
                },
                "lineNumber": {
                  "type": "integer",
                  "minimum": 1
                },
                "original": {
                  "type": "object",
                  "required": ["language", "code"],
                  "properties": {
                    "language": { "type": "string" },
                    "code": { "type": "string" }
                  }
                },
                "translation": {
                  "type": "object",
                  "required": ["language", "code"],
                  "properties": {
                    "language": { "type": "string" },
                    "code": { "type": "string" }
                  }
                },
                "harness": {
                  "type": "object",
                  "required": ["functionSignature", "fullContext"],
                  "properties": {
                    "functionSignature": { "type": "string" },
                    "stubTypes": { "type": ["string", "null"] },
                    "fullContext": { "type": "string" }
                  }
                },
                "translationNotes": {
                  "type": "array",
                  "items": {
                    "type": "object",
                    "required": ["type", "message"],
                    "properties": {
                      "type": {
                        "type": "string",
                        "enum": ["decision", "deviation", "info", "warning"]
                      },
                      "message": { "type": "string" }
                    }
                  }
                },
                "verification": {
                  "type": "object",
                  "required": ["compilation", "faithfulness"],
                  "properties": {
                    "compilation": {
                      "type": "object",
                      "required": ["status"],
                      "properties": {
                        "status": {
                          "type": "string",
                          "enum": ["pass", "fail"]
                        },
                        "errorMessage": { "type": "string" }
                      }
                    },
                    "faithfulness": {
                      "type": "object",
                      "required": ["rating"],
                      "properties": {
                        "rating": {
                          "type": "string",
                          "enum": ["faithful", "minor_differences", "significant_deviation", "not_assessed"]
                        },
                        "notes": { "type": ["string", "null"] }
                      }
                    }
                  }
                }
              }
            }
          }
        }
      }
    }
  }
}
